{
  "id": "ts-refactor-even",
  "repo": "ts-lib",
  "category": "refactor",
  "tags": [],
  "prompt": "Refactor even to a single reduce traversal, removing filter and map. Run node --test --test-name-pattern=\"^even$\".",
  "setup": [],
  "check": {
    "command": "node --test --test-name-pattern=\"^even$\"",
    "expectExit": 0
  },
  "extraChecks": [],
  "answerContains": [],
  "requires": [],
  "timeoutSec": 180,
  "maxTurns": 3
}
