{
  "id": "ts-bugfix-unique",
  "repo": "ts-lib",
  "category": "bugfix",
  "tags": [
    "smoke"
  ],
  "prompt": "Fix unique to remove duplicates preserving order. Run node --test --test-name-pattern=\"^unique$\".",
  "setup": [],
  "check": {
    "command": "node --test --test-name-pattern=\"^unique$\"",
    "expectExit": 0
  },
  "extraChecks": [],
  "answerContains": [],
  "requires": [],
  "timeoutSec": 180,
  "maxTurns": 3
}
