{
  "id": "ts-bugfix-clamp",
  "repo": "ts-lib",
  "category": "bugfix",
  "tags": [],
  "prompt": "Fix clamp to enforce both bounds. Run node --test --test-name-pattern=\"^clamp$\" test/lib.test.js.",
  "setup": [],
  "check": {
    "command": "node --test --test-name-pattern=\"^clamp$\" test/lib.test.js",
    "expectExit": 0
  },
  "extraChecks": [],
  "answerContains": [],
  "requires": [],
  "timeoutSec": 180,
  "maxTurns": 3
}
