{
  "id": "ts-bugfix-range",
  "repo": "ts-lib",
  "category": "bugfix",
  "tags": [
    "smoke"
  ],
  "prompt": "Fix range(n): it returns n+1 items. Run node --test --test-name-pattern=\"^range$\" test/lib.test.js.",
  "setup": [],
  "check": {
    "command": "node --test --test-name-pattern=\"^range$\" test/lib.test.js",
    "expectExit": 0
  },
  "extraChecks": [],
  "answerContains": [],
  "requires": [],
  "timeoutSec": 180,
  "maxTurns": 3
}
